<?xml version="1.0" encoding="UTF-8"?>
<!DOCTYPE seguimiento SYSTEM "seguimiento.dtd">
<seguimiento>
    <asignatura grupo="m1v" nombre="Bases de datos">
        <tema n="1" fini="2025-9-15" ffin="2025-9-17" comentario=""/>
        <tema n="2" fini="2025-9-18" ffin="2025-10-16" comentario=""/>
        <tema n="3" fini="2025-10-20" ffin="2025-12-1" comentario=""/>
        <tema n="4" fini="2025-12-3" ffin="2026-1-22" comentario=""/>
        <tema n="5" fini="2026-1-22" ffin="" comentario=""/>
        <tema n="6" fini="" ffin="" comentario=""/>
        <tema n="7" fini="" ffin="" comentario=""/>
        <tema n="8" fini="" ffin="" comentario=""/>
        <tema n="9" fini="" ffin="" comentario=""/>
    </asignatura>
    <asignatura grupo="m1v" nombre="Entornos de desarrollo">
        <tema n="1" fini="2025-9-30" ffin="2025-10-10" comentario=""/>
        <tema n="2" fini="2025-10-14" ffin="2025-10-24" comentario=""/>
        <tema n="3" fini="2025-10-28" ffin="2025-12-2" comentario=""/>
        <tema n="4" fini="2025-12-5" ffin="2026-2-13" comentario=""/>
        <tema n="5" fini="2026-2-17" ffin="" comentario=""/>
        <tema n="6" fini="" ffin="" comentario=""/>
        <tema n="7" fini="" ffin="" comentario=""/>
    </asignatura>
    <asignatura grupo="m1v" nombre="Lenguajes de marcas">
        <tema n="1" fini="2025-9-26" ffin="2025-10-10" comentario=""/>
        <tema n="2" fini="2025-10-15" ffin="2025-12-19" comentario=""/>
        <tema n="3" fini="2026-2-18" ffin="" comentario=""/>
        <tema n="4" fini="2026-1-9" ffin="2026-2-13" comentario=""/>
        <tema n="5" fini="" ffin="" comentario=""/>
        <tema n="6" fini="" ffin="" comentario=""/>
        <tema n="7" fini="" ffin="" comentario=""/>
        <tema n="8" fini="" ffin="" comentario=""/>
        <tema n="9" fini="" ffin="" comentario=""/>
    </asignatura>
    <asignatura grupo="m2v" nombre="Acceso a datos">
        <tema n="1" fini="2025-9-26" ffin="2025-10-10" comentario=""/>
        <tema n="2" fini="2025-10-13" ffin="2025-10-31" comentario="Huelgas y Problemas tren"/>
        <tema n="3" fini="2025-12-5" ffin="2025-12-18" comentario=""/>
        <tema n="4" fini="2025-11-6" ffin="2025-11-21" comentario=""/>
        <tema n="5" fini="2026-1-8" ffin="2026-1-23" comentario=""/>
        <tema n="6" fini="2025-11-24" ffin="2025-12-19" comentario=""/>
        <tema n="7" fini="2026-1-26" ffin="2026-2-13" comentario=""/>
    </asignatura>
    <asignatura grupo="m2v" nombre="Programación de móviles y dispositivos multimedia">
        <tema n="1" fini="2025-9-26" ffin="2025-10-7" comentario=""/>
        <tema n="2" fini="2025-10-9" ffin="2025-10-21" comentario=""/>
        <tema n="3" fini="2025-10-23" ffin="2025-11-25" comentario=""/>
        <tema n="4" fini="2025-11-27" ffin="2025-12-9" comentario=""/>
        <tema n="5" fini="2025-12-9" ffin="2026-1-21" comentario=""/>
        <tema n="6" fini="2026-1-22" ffin="2026-2-12" comentario=""/>
        <tema n="7" fini="" ffin="" comentario=""/>
        <tema n="8" fini="" ffin="" comentario=""/>
    </asignatura>
</seguimiento>
