<?xml version="1.0" encoding="UTF-8"?>
<!DOCTYPE seguimiento SYSTEM "seguimiento.dtd">
<seguimiento>
    <asignatura grupo="m1d" nombre="Programación">
        <tema n="1" fini="2025-9-29" ffin="2025-10-1" comentario=""/>
        <tema n="2" fini="2025-10-2" ffin="2025-10-16" comentario=""/>
        <tema n="3" fini="2025-10-17" ffin="2025-10-27" comentario=""/>
        <tema n="4" fini="2025-10-29" ffin="2025-11-12" comentario=""/>
        <tema n="5" fini="2026-1-8" ffin="2026-1-30" comentario=""/>
        <tema n="6" fini="2025-11-17" ffin="2025-12-8" comentario=""/>
        <tema n="7" fini="2025-12-10" ffin="2025-12-19" comentario=""/>
        <tema n="8" fini="2026-1-8" ffin="2026-1-30" comentario=""/>
        <tema n="9" fini="2026-2-2" ffin="2026-2-9" comentario=""/>
        <tema n="10" fini="2026-2-11" ffin="" comentario=""/>
        <tema n="11" fini="" ffin="" comentario=""/>
        <tema n="12" fini="" ffin="" comentario=""/>
        <tema n="13" fini="" ffin="" comentario=""/>
        <tema n="14" fini="" ffin="" comentario=""/>
        <tema n="15" fini="" ffin="" comentario=""/>
    </asignatura>
    <asignatura grupo="m2d" nombre="Digitalización aplicada a los sectores productivos">
        <tema n="1" fini="2025-9-29" ffin="2025-10-6" comentario=""/>
        <tema n="2" fini="2025-10-20" ffin="2025-10-27" comentario=""/>
        <tema n="3" fini="2025-11-3" ffin="2025-11-10" comentario=""/>
        <tema n="4" fini="2025-11-24" ffin="2025-12-1" comentario=""/>
        <tema n="5" fini="2025-12-15" ffin="2025-12-15" comentario=""/>
        <tema n="6" fini="2026-1-12" ffin="2026-1-30" comentario=""/>
    </asignatura>
    <asignatura grupo="m2d" nombre="Programación de servicios y procesos">
        <tema n="1" fini="2025-10-1" ffin="2025-10-17" comentario=""/>
        <tema n="2" fini="2025-10-22" ffin="2025-11-7" comentario=""/>
        <tema n="3" fini="2025-11-17" ffin="2025-11-28" comentario=""/>
        <tema n="4" fini="2025-12-3" ffin="2025-12-19" comentario=""/>
        <tema n="5" fini="2026-1-9" ffin="2026-1-30" comentario=""/>
    </asignatura>
    <asignatura grupo="m2d" nombre="Sistemas de gestión empresarial">
        <tema n="1" fini="2025-9-30" ffin="2025-10-7" comentario=""/>
        <tema n="2" fini="2025-10-9" ffin="2025-11-6" comentario=""/>
        <tema n="3" fini="2025-12-2" ffin="2025-12-19" comentario=""/>
        <tema n="4" fini="2025-11-18" ffin="2025-11-27" comentario=""/>
        <tema n="5" fini="2026-1-8" ffin="2026-1-15" comentario=""/>
        <tema n="6" fini="2026-1-20" ffin="2026-1-29" comentario=""/>
    </asignatura>
</seguimiento>
