<?xml version="1.0" encoding="UTF-8"?>
<!DOCTYPE seguimiento SYSTEM "seguimiento.dtd">
<seguimiento>
	<asignatura grupo="w2" nombre="Desarrollo de aplicaciones web en entorno cliente">
		<tema n="1" fini="2025-9-26" ffin="2025-9-26" comentario=""/>
		<tema n="2" fini="2025-9-29" ffin="2025-10-22" comentario=""/>
		<tema n="3" fini="2025-10-22" ffin="2025-11-19" comentario=""/>
		<tema n="4" fini="2025-11-20" ffin="2026-1-14" comentario=""/>
		<tema n="5" fini="2026-1-14" ffin="" comentario=""/>
		<tema n="6" fini="" ffin="" comentario=""/>
		<tema n="7" fini="" ffin="" comentario=""/>
	</asignatura>
</seguimiento>
