<?xml version="1.0" encoding="UTF-8"?>
<!DOCTYPE seguimiento SYSTEM "seguimiento.dtd">
<seguimiento>
    <asignatura grupo="w1" nombre="Programación">
        <tema n="1" fini="2025-9-29" ffin="2025-10-3" comentario=""/>
        <tema n="2" fini="2025-10-6" ffin="2025-10-17" comentario=""/>
        <tema n="3" fini="2025-10-20" ffin="2025-11-4" comentario=""/>
        <tema n="4" fini="2025-11-5" ffin="2025-11-18" comentario=""/>
        <tema n="5" fini="2026-1-29" ffin="2026-2-9" comentario=""/>
        <tema n="6" fini="2025-11-19" ffin="2025-12-18" comentario=""/>
        <tema n="7" fini="2025-12-19" ffin="2026-1-28" comentario=""/>
        <tema n="8" fini="2026-2-10" ffin="2026-2-17" comentario=""/>
        <tema n="9" fini="2026-2-18" ffin="" comentario=""/>
        <tema n="10" fini="" ffin="" comentario=""/>
        <tema n="11" fini="" ffin="" comentario=""/>
        <tema n="12" fini="" ffin="" comentario=""/>
        <tema n="13" fini="" ffin="" comentario=""/>
        <tema n="14" fini="" ffin="" comentario=""/>
        <tema n="15" fini="" ffin="" comentario=""/>
    </asignatura>
    <asignatura grupo="w2" nombre="Desarrollo de aplicaciones web en entorno servidor">
        <tema n="1" fini="2025-9-29" ffin="2025-10-9" comentario=""/>
        <tema n="2" fini="2025-10-10" ffin="2025-10-20" comentario=""/>
        <tema n="3" fini="2025-10-21" ffin="2025-11-6" comentario=""/>
        <tema n="4" fini="2025-11-7" ffin="2025-11-14" comentario=""/>
        <tema n="5" fini="2025-11-17" ffin="2025-12-2" comentario=""/>
        <tema n="6" fini="2025-12-5" ffin="2025-12-19" comentario=""/>
        <tema n="7" fini="2026-1-9" ffin="2026-1-15" comentario=""/>
        <tema n="8" fini="2026-1-16" ffin="2026-1-30" comentario=""/>
        <tema n="9" fini="2026-2-16" ffin="2026-2-17" comentario=""/>
        <tema n="10" fini="2026-2-23" ffin="" comentario=""/>
    </asignatura>
</seguimiento>
