<?xml version="1.0" encoding="UTF-8"?>
<!DOCTYPE seguimiento SYSTEM "seguimiento.dtd">
<seguimiento>
    <asignatura grupo="i1" nombre="Montaje y mantenimiento de sistemas">
        <tema n="1" fini="2025-9-11" ffin="2025-9-18" comentario=""/>
        <tema n="2" fini="2025-9-18" ffin="2025-9-23" comentario=""/>
        <tema n="3" fini="2025-9-23" ffin="2025-10-10" comentario=""/>
        <tema n="4" fini="2025-10-10" ffin="2025-10-29" comentario=""/>
        <tema n="5" fini="2025-10-29" ffin="2025-11-17" comentario=""/>
        <tema n="6" fini="2025-11-18" ffin="2025-11-28" comentario=""/>
        <tema n="7" fini="2025-12-1" ffin="2026-1-6" comentario=""/>
        <tema n="8" fini="2026-1-6" ffin="2026-1-27" comentario=""/>
        <tema n="9" fini="2026-1-28" ffin="2026-2-16" comentario=""/>
        <tema n="10" fini="2026-2-16" ffin="" comentario=""/>
        <tema n="11" fini="" ffin="" comentario=""/>
        <tema n="12" fini="" ffin="" comentario=""/>
        <tema n="13" fini="" ffin="" comentario=""/>
        <tema n="14" fini="" ffin="" comentario=""/>
        <tema n="15" fini="" ffin="" comentario=""/>
    </asignatura>
    <asignatura grupo="i2" nombre="Instalación y mantenimiento de redes para transmisión de datos">
        <tema n="1" fini="2025-9-11" ffin="2025-9-24" comentario=""/>
        <tema n="2" fini="2025-9-25" ffin="2025-10-16" comentario=""/>
        <tema n="3" fini="2025-10-25" ffin="2025-11-18" comentario=""/>
        <tema n="4" fini="2025-11-18" ffin="2025-12-10" comentario=""/>
        <tema n="5" fini="2025-12-11" ffin="2026-1-26" comentario=""/>
        <tema n="6" fini="2026-1-28" ffin="2026-2-18" comentario=""/>
        <tema n="7" fini="" ffin="" comentario=""/>
        <tema n="8" fini="" ffin="" comentario=""/>
        <tema n="9" fini="" ffin="" comentario=""/>
    </asignatura>
</seguimiento>
