<?xml version="1.0" encoding="UTF-8"?>
<!DOCTYPE seguimiento SYSTEM "seguimiento.dtd">
<seguimiento>
    <asignatura grupo="w2" nombre="Diseño de interfaces web">
        <tema n="1" fini="2025-9-16" ffin="2025-9-17" comentario=""/>
        <tema n="2" fini="2025-9-18" ffin="2025-9-23" comentario=""/>
        <tema n="3" fini="2025-9-24" ffin="2025-9-30" comentario=""/>
        <tema n="4" fini="2025-10-1" ffin="2025-10-21" comentario=""/>
        <tema n="5" fini="2025-10-22" ffin="2025-11-18" comentario=""/>
        <tema n="6" fini="2025-11-19" ffin="2025-11-25" comentario=""/>
        <tema n="7" fini="2025-11-26" ffin="2025-12-2" comentario=""/>
        <tema n="8" fini="2025-12-3" ffin="2026-1-27" comentario=""/>
        <tema n="9" fini="" ffin="" comentario=""/>
        <tema n="10" fini="" ffin="" comentario=""/>
    </asignatura>
</seguimiento>
