<?xml version="1.0" encoding="UTF-8"?>
<!DOCTYPE seguimiento SYSTEM "seguimiento.dtd">
<seguimiento>
    <asignatura grupo="m1d" nombre="Sistemas informáticos">
        <tema n="1" fini="2025-9-15" ffin="2025-9-29" comentario=""/>
        <tema n="2" fini="2025-10-1" ffin="2025-10-21" comentario=""/>
        <tema n="3" fini="2025-10-22" ffin="2025-11-5" comentario=""/>
        <tema n="4" fini="2025-11-6" ffin="2025-12-5" comentario=""/>
        <tema n="5" fini="2025-12-9" ffin="2026-1-29" comentario=""/>
        <tema n="6" fini="" ffin="" comentario=""/>
        <tema n="7" fini="" ffin="" comentario=""/>
        <tema n="8" fini="" ffin="" comentario=""/>
        <tema n="9" fini="" ffin="" comentario=""/>
        <tema n="10" fini="" ffin="" comentario=""/>
        <tema n="11" fini="" ffin="" comentario=""/>
    </asignatura>
    <asignatura grupo="m2d" nombre="Desarrollo de interfaces">
        <tema n="1" fini="2025-9-15" ffin="2025-10-20" comentario=""/>
        <tema n="2" fini="2025-10-21" ffin="2025-11-18" comentario=""/>
        <tema n="3" fini="2025-11-19" ffin="2025-12-18" comentario=""/>
        <tema n="4" fini="2025-12-19" ffin="2026-1-27" comentario=""/>
        <tema n="5" fini="2026-1-29" ffin="" comentario=""/>
        <tema n="6" fini="" ffin="" comentario=""/>
        <tema n="7" fini="" ffin="" comentario=""/>
        <tema n="8" fini="" ffin="" comentario=""/>
    </asignatura>
    <asignatura grupo="w1" nombre="Sistemas informáticos">
        <tema n="1" fini="2025-9-15" ffin="2025-9-29" comentario=""/>
        <tema n="2" fini="2025-9-30" ffin="2025-10-16" comentario=""/>
        <tema n="3" fini="2025-10-20" ffin="2025-11-5" comentario=""/>
        <tema n="4" fini="2025-11-6" ffin="2025-12-5" comentario=""/>
        <tema n="5" fini="2025-12-9" ffin="2026-1-29" comentario=""/>
        <tema n="6" fini="" ffin="" comentario=""/>
        <tema n="7" fini="" ffin="" comentario=""/>
        <tema n="8" fini="" ffin="" comentario=""/>
        <tema n="9" fini="" ffin="" comentario=""/>
        <tema n="10" fini="" ffin="" comentario=""/>
        <tema n="11" fini="" ffin="" comentario=""/>
    </asignatura>
    <asignatura grupo="s1a" nombre="Fundamentos de las Bases de datos">
        <tema n="1" fini="2025-9-15" ffin="2025-10-14" comentario=""/>
        <tema n="2" fini="2025-10-21" ffin="2025-11-17" comentario=""/>
        <tema n="3" fini="2025-11-18" ffin="2026-1-14" comentario=""/>
        <tema n="4" fini="2026-1-20" ffin="" comentario=""/>
        <tema n="5" fini="" ffin="" comentario=""/>
        <tema n="6" fini="" ffin="" comentario=""/>
    </asignatura>
</seguimiento>
