<?xml version="1.0" encoding="UTF-8"?>
<!DOCTYPE seguimiento SYSTEM "seguimiento.dtd">
<seguimiento>
    <asignatura grupo="s1b" nombre="Montaje y mantenimiento de equipos">
        <tema n="1" fini="2025-9-16" ffin="2025-9-30" comentario=""/>
        <tema n="2" fini="2025-10-2" ffin="2025-10-14" comentario=""/>
        <tema n="3" fini="2025-10-16" ffin="2025-10-28" comentario=""/>
        <tema n="4" fini="2025-10-30" ffin="2025-11-11" comentario=""/>
        <tema n="5" fini="2025-11-13" ffin="2025-11-25" comentario=""/>
        <tema n="6" fini="2025-11-25" ffin="2025-12-2" comentario=""/>
        <tema n="7" fini="2025-12-2" ffin="2025-12-11" comentario=""/>
        <tema n="8" fini="2025-12-11" ffin="2025-12-18" comentario=""/>
        <tema n="9" fini="2026-1-8" ffin="2026-1-20" comentario=""/>
        <tema n="10" fini="2026-1-20" ffin="2026-2-5" comentario=""/>
        <tema n="11" fini="2026-2-5" ffin="2026-2-12" comentario=""/>
        <tema n="12" fini="" ffin="" comentario=""/>
        <tema n="13" fini="" ffin="" comentario=""/>
        <tema n="20" fini="" ffin="" comentario=""/>
    </asignatura>
</seguimiento>
