<?xml version="1.0" encoding="UTF-8"?>
<!DOCTYPE seguimiento SYSTEM "seguimiento.dtd">
<seguimiento>
    <asignatura grupo="s2a" nombre="Seguridad en redes">
        <tema n="1" fini="2025-10-1" ffin="2025-10-16" comentario=""/>
        <tema n="2" fini="2025-10-22" ffin="2025-10-23" comentario=""/>
        <tema n="3" fini="2025-10-29" ffin="2025-11-19" comentario=""/>
        <tema n="4" fini="2025-11-26" ffin="2025-12-18" comentario=""/>
        <tema n="5" fini="2026-1-8" ffin="2026-1-15" comentario=""/>
        <tema n="6" fini="2026-1-22" ffin="2026-2-11" comentario=""/>
        <tema n="7" fini="" ffin="" comentario="No ha dado tiempo a impartir esta Unidad por haberme incorporardo tarde al curso"/>
        <tema n="8" fini="" ffin="" comentario=""/>
        <tema n="9" fini="" ffin="" comentario=""/>
        <tema n="10" fini="" ffin="" comentario=""/>
    </asignatura>
    <asignatura grupo="s2b" nombre="Seguridad en redes">
        <tema n="1" fini="2025-10-1" ffin="2025-10-16" comentario=""/>
        <tema n="2" fini="2025-10-22" ffin="2025-10-23" comentario=""/>
        <tema n="3" fini="2025-10-29" ffin="2025-11-19" comentario=""/>
        <tema n="4" fini="2025-11-26" ffin="2025-12-18" comentario=""/>
        <tema n="5" fini="2026-1-8" ffin="2026-1-15" comentario=""/>
        <tema n="6" fini="2026-1-22" ffin="2026-2-11" comentario=""/>
        <tema n="7" fini="" ffin="" comentario="No ha dado tiempo a impartir esta Unidad por haberme incorporardo tarde al curso"/>
        <tema n="8" fini="" ffin="" comentario=""/>
        <tema n="9" fini="" ffin="" comentario=""/>
        <tema n="10" fini="" ffin="" comentario=""/>
    </asignatura>
</seguimiento>
